{
  "version": "v31",
  "title": "Marin-9.5M 512bp GPN animal promoter 417sp",
  "description": "Qwen model pretrained on animal promoter data with all 417 species (no filtering)",
  "experiment_group": "animals_promoter",

  "analysis__method": "model_activation_pca",
  "analysis__context_length": 512,
  "analysis__pooling_method": "mean",
  "analysis__sample_sizes": [512, 4096, 16384, 65536, 262144],
  "analysis__max_sample_size": 262144,
  "analysis__max_rank": 384,

  "model__name": "gpn_promoter_pretrain_c512_v0.2",
  "model__type": "CLM",
  "model__source": "marin",
  "model__training_status": "trained",
  "model__flop_budget": null,
  "model__width_class": null,
  "model__simulation_mode": null,

  "data__modality": "dna",
  "data__kingdom": "animals",
  "data__dataset": "eczech/gpn-animal-promoter-dataset",
  "data__split": "train",
  "data__species_filter": "all",
  "data__species_filter_value": null,

  "reference__github_issue": null,
  "reference__wandb_run": "https://wandb.ai/eric-czech/plantcad-eigenanalysis/runs/4ihb7bbj",
  "reference__model_hub_path": "plantcad/marin_exp2101__pcv2_pretrain_c4096__checkpoints"
}

