{
  "version": "v33",
  "title": "NTv2-50M animal promoter 65 species",
  "description": "Nucleotide Transformer v2 50M on animal promoter dataset filtered to 65 species",
  "experiment_group": "animals_promoter",

  "analysis__method": "model_activation_pca",
  "analysis__context_length": 512,
  "analysis__pooling_method": "mean",
  "analysis__sample_sizes": [4096, 8192, 16384],
  "analysis__max_sample_size": 16384,
  "analysis__max_rank": 512,

  "model__name": "nucleotide-transformer-v2-50m-multi-species",
  "model__type": "MLM",
  "model__source": "ntv2",
  "model__training_status": "trained",
  "model__flop_budget": null,
  "model__width_class": null,
  "model__simulation_mode": null,

  "data__modality": "dna",
  "data__kingdom": "animals",
  "data__dataset": "eczech/gpn-animal-promoter-dataset",
  "data__split": "train",
  "data__species_filter": "species_subset",
  "data__species_filter_value": "gpn_promoter_65_most_common_species.txt",

  "reference__github_issue": null,
  "reference__wandb_run": null,
  "reference__model_hub_path": "InstaDeepAI/nucleotide-transformer-v2-50m-multi-species"
}

