{
  "version": "v38",
  "title": "GPN-Brassicales 512bp Angiosperm 3sp",
  "description": "GPN Brassicales model on PlantCAD dataset filtered to 3 shared species (Athaliana, Crubella, Esalsugineum)",
  "experiment_group": "plantcad2_baseline",

  "analysis__method": "model_activation_pca",
  "analysis__context_length": 512,
  "analysis__pooling_method": "mean",
  "analysis__sample_sizes": [8192, 16384, 65536, 98304],
  "analysis__max_sample_size": 98304,
  "analysis__max_rank": 512,

  "model__name": "gpn-brassicales",
  "model__type": "MLM",
  "model__source": "gpn",
  "model__training_status": "trained",
  "model__flop_budget": null,
  "model__width_class": null,
  "model__simulation_mode": null,

  "data__modality": "dna",
  "data__kingdom": "plants",
  "data__dataset": "plantcad/Angiosperm_65_genomes_8192bp",
  "data__split": "train",
  "data__species_filter": "species_subset",
  "data__species_filter_value": "gpn_plantcad_shared_species.txt",

  "reference__github_issue": null,
  "reference__wandb_run": null,
  "reference__model_hub_path": "songlab/gpn-brassicales"
}

