{
  "version": "v34",
  "title": "AgroNT-1B 6144bp Angiosperm 2.6M 65sp",
  "description": "Agro-Nucleotide Transformer 1B on PlantCAD Angiosperm 65 genomes dataset",
  "experiment_group": "plantcad2_baseline",

  "analysis__method": "model_activation_pca",
  "analysis__context_length": 6144,
  "analysis__pooling_method": "mean",
  "analysis__sample_sizes": [16384, 32768, 65536],
  "analysis__max_sample_size": 65536,
  "analysis__max_rank": 1500,

  "model__name": "agro-nucleotide-transformer-1b",
  "model__type": "MLM",
  "model__source": "ntv2",
  "model__training_status": "trained",
  "model__flop_budget": null,
  "model__width_class": null,
  "model__simulation_mode": null,

  "data__modality": "dna",
  "data__kingdom": "plants",
  "data__dataset": "plantcad/Angiosperm_65_genomes_8192bp",
  "data__split": "train",
  "data__species_filter": "all",
  "data__species_filter_value": null,

  "reference__github_issue": null,
  "reference__wandb_run": null,
  "reference__model_hub_path": "InstaDeepAI/agro-nucleotide-transformer-1b"
}

