{
  "version": "v32",
  "title": "NTv2-50M 8192bp Multi-species genomes",
  "description": "Nucleotide Transformer v2 50M on InstaDeep multi-species genomes dataset",
  "experiment_group": "animals_promoter",

  "analysis__method": "model_activation_pca",
  "analysis__context_length": 8192,
  "analysis__pooling_method": "mean",
  "analysis__sample_sizes": [4096, 8192, 16384],
  "analysis__max_sample_size": 16384,
  "analysis__max_rank": 512,

  "model__name": "nucleotide-transformer-v2-50m-multi-species",
  "model__type": "MLM",
  "model__source": "ntv2",
  "model__training_status": "trained",
  "model__flop_budget": null,
  "model__width_class": null,
  "model__simulation_mode": null,

  "data__modality": "dna",
  "data__kingdom": "animals",
  "data__dataset": "InstaDeepAI/multi_species_genomes",
  "data__split": "train",
  "data__species_filter": "all",
  "data__species_filter_value": null,

  "reference__github_issue": null,
  "reference__wandb_run": null,
  "reference__model_hub_path": "InstaDeepAI/nucleotide-transformer-v2-50m-multi-species"
}

